{
  "schema_version": 1,
  "run_id": "20260523T151024Z-pr-closeout-4df36134",
  "case_id": "pr-closeout",
  "suite_id": "smoke",
  "execution_mode": "synthetic",
  "status": "passed",
  "deterministic_verdict": "pass",
  "scorer_results_path": ".harness/evals/runs/20260523T151024Z-pr-closeout-4df36134/scorer-results.json",
  "baseline_result_path": ".harness/evals/runs/20260523T151024Z-pr-closeout-4df36134/baseline-result.json",
  "trace_events_path": ".harness/evals/runs/20260523T151024Z-pr-closeout-4df36134/trace-events.jsonl",
  "artifact_refs": [
    {
      "type": "report",
      "path": ".harness/evals/runs/20260523T151024Z-pr-closeout-4df36134/report.md",
      "sha256": "a4749079c09ef2197e4a3774cc5dfb8a382effe1e753a02996bb0a3a78698d35"
    },
    {
      "type": "command-log",
      "path": ".harness/evals/runs/20260523T151024Z-pr-closeout-4df36134/command-log.json",
      "sha256": "d76630c67e37c6de597141b841ce146aefd248a5aad9bc5507fc05174ba81ffa"
    },
    {
      "type": "scorer-results",
      "path": ".harness/evals/runs/20260523T151024Z-pr-closeout-4df36134/scorer-results.json",
      "sha256": "687369a805d3101b30090415a53a7d94f94818aab3a965e557b7d255d0bf1723"
    },
    {
      "type": "baseline-result",
      "path": ".harness/evals/runs/20260523T151024Z-pr-closeout-4df36134/baseline-result.json",
      "sha256": "07191fab43c55516154e43442068ec7a4809bf45f156e1ffeae2cb829d55e31f"
    },
    {
      "type": "trace-events",
      "path": ".harness/evals/runs/20260523T151024Z-pr-closeout-4df36134/trace-events.jsonl",
      "sha256": "d91f5361ac17be3b91f9696f8e2c7c935fbffa3ef88944327077f82276c43c07"
    }
  ],
  "errors": []
}
