{
  "schema_version": 1,
  "run_id": "20260525T003124Z-pr-closeout-4df36134",
  "case_id": "pr-closeout",
  "suite_id": "smoke",
  "execution_mode": "synthetic",
  "status": "passed",
  "deterministic_verdict": "pass",
  "scorer_results_path": ".harness/evals/runs/20260525T003124Z-pr-closeout-4df36134/scorer-results.json",
  "baseline_result_path": ".harness/evals/runs/20260525T003124Z-pr-closeout-4df36134/baseline-result.json",
  "trace_events_path": ".harness/evals/runs/20260525T003124Z-pr-closeout-4df36134/trace-events.jsonl",
  "artifact_refs": [
    {
      "type": "report",
      "path": ".harness/evals/runs/20260525T003124Z-pr-closeout-4df36134/report.md",
      "sha256": "c647f7e303b8270baa591372940eb97baae6787924efd1be772d1ec251da3925"
    },
    {
      "type": "command-log",
      "path": ".harness/evals/runs/20260525T003124Z-pr-closeout-4df36134/command-log.json",
      "sha256": "b83777c03b269576a7748fbbdea575dfc8d2076f49a06c6e0ad2a9e14da737b9"
    },
    {
      "type": "scorer-results",
      "path": ".harness/evals/runs/20260525T003124Z-pr-closeout-4df36134/scorer-results.json",
      "sha256": "687369a805d3101b30090415a53a7d94f94818aab3a965e557b7d255d0bf1723"
    },
    {
      "type": "baseline-result",
      "path": ".harness/evals/runs/20260525T003124Z-pr-closeout-4df36134/baseline-result.json",
      "sha256": "de6e2978c436c62601fe079e3099dad6027fe47d1aca904fb3de9183566d0d7a"
    },
    {
      "type": "trace-events",
      "path": ".harness/evals/runs/20260525T003124Z-pr-closeout-4df36134/trace-events.jsonl",
      "sha256": "acb66af181d950c730a87598c9bc418425ae422876ba07405f4ec371d36eb441"
    }
  ],
  "errors": []
}
