{
  "schema_version": 1,
  "run_id": "20260525T083004Z-pr-closeout-4df36134-01",
  "case_id": "pr-closeout",
  "suite_id": "smoke",
  "execution_mode": "synthetic",
  "status": "passed",
  "deterministic_verdict": "pass",
  "scorer_results_path": ".harness/evals/runs/20260525T083004Z-pr-closeout-4df36134-01/scorer-results.json",
  "baseline_result_path": ".harness/evals/runs/20260525T083004Z-pr-closeout-4df36134-01/baseline-result.json",
  "trace_events_path": ".harness/evals/runs/20260525T083004Z-pr-closeout-4df36134-01/trace-events.jsonl",
  "artifact_refs": [
    {
      "type": "report",
      "path": ".harness/evals/runs/20260525T083004Z-pr-closeout-4df36134-01/report.md",
      "sha256": "94e8e06159e8042c8041e8d33aeab0473b12b3dc4bb18e6e86feb52b9b1c24f0"
    },
    {
      "type": "command-log",
      "path": ".harness/evals/runs/20260525T083004Z-pr-closeout-4df36134-01/command-log.json",
      "sha256": "8738d1b5c3b5c133109c4548187e93321357bd76d5a87dd4512b6ea784a82192"
    },
    {
      "type": "scorer-results",
      "path": ".harness/evals/runs/20260525T083004Z-pr-closeout-4df36134-01/scorer-results.json",
      "sha256": "687369a805d3101b30090415a53a7d94f94818aab3a965e557b7d255d0bf1723"
    },
    {
      "type": "baseline-result",
      "path": ".harness/evals/runs/20260525T083004Z-pr-closeout-4df36134-01/baseline-result.json",
      "sha256": "89198bb724c2054fd42f2769357447dc023c6c3d68b84d58757dea407ae36db0"
    },
    {
      "type": "trace-events",
      "path": ".harness/evals/runs/20260525T083004Z-pr-closeout-4df36134-01/trace-events.jsonl",
      "sha256": "6b550e55512b2c5d4eefe38173b7310195e7edc663758b2e8f16e6b6baac0bfa"
    }
  ],
  "errors": []
}
