{
  "schema_version": 1,
  "run_id": "20260523T153106Z-pr-closeout-4df36134",
  "case_id": "pr-closeout",
  "suite_id": "smoke",
  "execution_mode": "synthetic",
  "status": "passed",
  "deterministic_verdict": "pass",
  "scorer_results_path": ".harness/evals/runs/20260523T153106Z-pr-closeout-4df36134/scorer-results.json",
  "baseline_result_path": ".harness/evals/runs/20260523T153106Z-pr-closeout-4df36134/baseline-result.json",
  "trace_events_path": ".harness/evals/runs/20260523T153106Z-pr-closeout-4df36134/trace-events.jsonl",
  "artifact_refs": [
    {
      "type": "report",
      "path": ".harness/evals/runs/20260523T153106Z-pr-closeout-4df36134/report.md",
      "sha256": "a14b226602e40295c47f6f2f478c5b29526690fdf5f460f9ff4e175771c5698b"
    },
    {
      "type": "command-log",
      "path": ".harness/evals/runs/20260523T153106Z-pr-closeout-4df36134/command-log.json",
      "sha256": "5f091bc0ca9405136b33066aea3c13ae4d233ca4d4ee8421070e589fcd62e703"
    },
    {
      "type": "scorer-results",
      "path": ".harness/evals/runs/20260523T153106Z-pr-closeout-4df36134/scorer-results.json",
      "sha256": "687369a805d3101b30090415a53a7d94f94818aab3a965e557b7d255d0bf1723"
    },
    {
      "type": "baseline-result",
      "path": ".harness/evals/runs/20260523T153106Z-pr-closeout-4df36134/baseline-result.json",
      "sha256": "8a4877e8918bee75ffee71e3ed6e2f4a30a49a33dc12881f3eb3dc8de1fe82ea"
    },
    {
      "type": "trace-events",
      "path": ".harness/evals/runs/20260523T153106Z-pr-closeout-4df36134/trace-events.jsonl",
      "sha256": "eaf193d1d19ff9e8eeca33d6dc36bb6710c7edde7158983094a511b85e01bece"
    }
  ],
  "errors": []
}
